{
  "$schema": "https://json-schema.org/draft/2020-12/schema",
  "$id": "https://local.invalid/schemas/cognitive-provider-config.schema.json",
  "title": "Provider-neutral cognitive semantic runtime configuration",
  "type": "object",
  "additionalProperties": false,
  "required": [
    "schema_version",
    "provider_type",
    "command",
    "model_id",
    "timeout_seconds",
    "max_concurrency",
    "max_protocol_attempts",
    "locator_context_chars",
    "generation_parameters"
  ],
  "properties": {
    "schema_version": {"type": "string", "const": "1.0"},
    "provider_type": {"type": "string", "const": "command"},
    "command": {
      "type": "array",
      "minItems": 1,
      "items": {"type": "string", "minLength": 1}
    },
    "model_id": {"type": "string", "minLength": 1},
    "timeout_seconds": {
      "type": "number",
      "exclusiveMinimum": 0,
      "maximum": 600
    },
    "max_concurrency": {
      "type": "integer",
      "minimum": 1,
      "maximum": 16
    },
    "max_protocol_attempts": {
      "type": "integer",
      "const": 2
    },
    "locator_context_chars": {
      "type": "integer",
      "minimum": 0,
      "maximum": 1000
    },
    "generation_parameters": {
      "type": "object",
      "additionalProperties": false,
      "required": ["evidence_locator", "relation_adjudicator"],
      "properties": {
        "evidence_locator": {
          "$ref": "#/$defs/generation_parameters"
        },
        "relation_adjudicator": {
          "$ref": "#/$defs/generation_parameters"
        }
      }
    }
  },
  "$defs": {
    "generation_parameters": {
      "type": "object",
      "additionalProperties": false,
      "required": ["temperature", "top_p", "max_output_tokens", "seed"],
      "properties": {
        "temperature": {"type": "number", "minimum": 0, "maximum": 2},
        "top_p": {"type": "number", "exclusiveMinimum": 0, "maximum": 1},
        "max_output_tokens": {"type": "integer", "minimum": 64},
        "seed": {"type": ["integer", "null"]}
      }
    }
  }
}
